[
  {
    "control_id": "TLI-DPDP-SCO-01",
    "control_version": "1.0.0",
    "title": "Applicability, Jurisdiction and Material Perimeter",
    "objective": "Establish the material and territorial boundaries of digital personal data processing within and outside India.",
    "topic": "NOTICE_TRANSPARENCY",
    "subcategory": "Scope & Perimeter",
    "source_id": "SRC-01",
    "source_provision": "Section 3",
    "source_status": "ENACTED_STATUTE",
    "commencement_status": "SCHEDULED_COMMENCEMENT_13_MAY_2027",
    "obligation_type": "MANDATORY_STATUTORY",
    "legal_reference_summary": "The Act applies to the processing of digital personal data within India, and outside India if in connection with offering goods or services to Data Principals in India. Excludes personal/domestic use and publicly available data.",
    "applicability_conditions": "Applies universally to any entity processing personal data in digital form.",
    "applicability_rationale": "Core jurisdictional perimeter; non-excludable.",
    "assessment_question": "Has the organisation documented its digital personal data inventory, established jurisdictional boundaries, and identified all digital collection touchpoints?",
    "implementation_expectations": "Maintain an exhaustive inventory of digital processing activities (RoPA), categorising personal data collected within India or from Indian Data Principals abroad.",
    "acceptable_evidence": ["EVID-ROPA-01"],
    "evidence_limitations": "Verbal assertions without a documented data inventory are insufficient.",
    "assessment_guidance": "Verify whether offline data digitised subsequently is brought into scope as mandated by Section 3(a)(ii).",
    "risk_guidance": "Operating outside defined compliance scope risks unmonitored regulatory exposure across all processing streams.",
    "suggested_remediation": "Implement an enterprise Data Processing Activities Registry (RoPA) cataloguing data flows, storage locations, and legal entities.",
    "related_control_ids": ["TLI-DPDP-LGL-01"],
    "legal_review_status": "PROVISIONAL_RESEARCH_COMPLETE",
    "methodology_review_status": "METHODOLOGY_REVIEW_PENDING",
    "review_notes": "Awaiting final TLI legal review under DEC-08.",
    "created_at": "2026-10-11T12:00:00Z",
    "updated_at": "2026-10-11T12:00:00Z"
  },
  {
    "control_id": "TLI-DPDP-LGL-01",
    "control_version": "1.0.0",
    "title": "Lawful Basis and Ground of Processing",
    "objective": "Ensure all personal data processing is underpinned by valid consent or an exhaustive statutory legitimate use.",
    "topic": "LEGITIMATE_USES",
    "subcategory": "Lawful Grounds",
    "source_id": "SRC-01",
    "source_provision": "Section 4",
    "source_status": "ENACTED_STATUTE",
    "commencement_status": "SCHEDULED_COMMENCEMENT_13_MAY_2027",
    "obligation_type": "MANDATORY_STATUTORY",
    "legal_reference_summary": "Personal data may be processed only for a lawful purpose for which the Data Principal has given consent (Section 6), or for certain legitimate uses specified under Section 7.",
    "applicability_conditions": "Applies to all processing activities across all business units.",
    "applicability_rationale": "Foundational rule; no processing can exist without a valid statutory ground.",
    "assessment_question": "Is every personal data processing activity formally mapped to a distinct statutory ground (valid consent under Section 6 or an exhaustive legitimate use under Section 7)?",
    "implementation_expectations": "Document the legal ground for every data processing activity in the RoPA; eliminate processing lacking a valid statutory anchor.",
    "acceptable_evidence": ["EVID-ROPA-01", "EVID-SEC-01"],
    "evidence_limitations": "High-level privacy policies without activity-level legal mapping do not demonstrate compliance.",
    "assessment_guidance": "Confirm that the organisation does not rely on generic 'business interest' claims outside the exhaustive list of Section 7.",
    "risk_guidance": "Processing without a lawful basis constitutes an unlawful act under Section 4, exposing the fiduciary to statutory scrutiny.",
    "suggested_remediation": "Conduct a legal grounds audit mapping each personal data collection workflow to either Section 6 (Consent) or a Section 7 clause.",
    "related_control_ids": ["TLI-DPDP-CON-01", "TLI-DPDP-LEG-01"],
    "legal_review_status": "PROVISIONAL_RESEARCH_COMPLETE",
    "methodology_review_status": "METHODOLOGY_REVIEW_PENDING",
    "review_notes": "Awaiting final TLI legal review under DEC-08.",
    "created_at": "2026-10-11T12:00:00Z",
    "updated_at": "2026-10-11T12:00:00Z"
  },
  {
    "control_id": "TLI-DPDP-NOT-01",
    "control_version": "1.0.0",
    "title": "Itemised and Pre-Consent Notice",
    "objective": "Provide Data Principals with clear, itemised notice before seeking consent.",
    "topic": "NOTICE_TRANSPARENCY",
    "subcategory": "Itemised Notice",
    "source_id": "SRC-01",
    "source_provision": "Section 5(1) r/w Rule 3",
    "source_status": "NOTIFIED_RULES",
    "commencement_status": "SCHEDULED_COMMENCEMENT_13_MAY_2027",
    "obligation_type": "MANDATORY_STATUTORY",
    "legal_reference_summary": "Notice must be given before or at the time of seeking consent. It must specify the personal data sought, the specific itemised purpose, the manner of exercising Section 11 rights, and the manner of making complaints to the DPBI.",
    "applicability_conditions": "Applies to all activities where personal data is collected on the basis of consent.",
    "applicability_rationale": "Mandatory whenever consent is sought.",
    "assessment_question": "Does the organisation provide a clear, standalone, itemised notice before or at the time of requesting consent, detailing data types, purpose, rights, and DPBI complaint procedures?",
    "implementation_expectations": "Deploy discrete pre-consent notices detailing data fields, specific itemised purposes, DSAR instructions, and grievance redressal steps.",
    "acceptable_evidence": ["EVID-NOT-01"],
    "evidence_limitations": "Generic website terms of service or privacy policies bundled with commercial conditions do not satisfy Section 5(1).",
    "assessment_guidance": "Inspect actual collection touchpoints to verify notice timing and content.",
    "risk_guidance": "Inadequate or bundled notice invalidates consent under Section 6(1), undermining the legality of processing.",
    "suggested_remediation": "Redesign onboarding UI/UX to display standalone, itemised notices prior to consent checkboxes.",
    "related_control_ids": ["TLI-DPDP-NOT-03", "TLI-DPDP-CON-01"],
    "legal_review_status": "PROVISIONAL_RESEARCH_COMPLETE",
    "methodology_review_status": "METHODOLOGY_REVIEW_PENDING",
    "review_notes": "Awaiting final TLI legal review under DEC-08.",
    "created_at": "2026-10-11T12:00:00Z",
    "updated_at": "2026-10-11T12:00:00Z"
  },
  {
    "control_id": "TLI-DPDP-NOT-02",
    "control_version": "1.0.0",
    "title": "Historical Notice for Pre-Existing Consent",
    "objective": "Inform existing Data Principals of processing details for legacy consent captured prior to commencement.",
    "topic": "NOTICE_TRANSPARENCY",
    "subcategory": "Grandfathered Notice",
    "source_id": "SRC-01",
    "source_provision": "Section 5(2) r/w Rule 3",
    "source_status": "NOTIFIED_RULES",
    "commencement_status": "SCHEDULED_COMMENCEMENT_13_MAY_2027",
    "obligation_type": "MANDATORY_STATUTORY",
    "legal_reference_summary": "Where consent was collected prior to commencement, notice informing the Data Principal of data, purpose, rights, and DPBI grievance route must be dispatched as soon as practicable.",
    "applicability_conditions": "Applies to fiduciaries holding legacy personal data collected prior to 13 May 2027.",
    "applicability_rationale": "Mandatory for entities with legacy customer/user databases.",
    "assessment_question": "Has the organisation planned or dispatched retrospective notices to existing Data Principals whose consent was captured prior to the commencement of the Act?",
    "implementation_expectations": "Implement a communication protocol to send compliant Section 5 notices to existing registered users upon commencement.",
    "acceptable_evidence": ["EVID-NOT-03", "EVID-SOP-01"],
    "evidence_limitations": "Marketing email campaigns without statutory notice elements do not qualify.",
    "assessment_guidance": "Verify communications schedules, customer notification email/SMS templates, and audit logs.",
    "risk_guidance": "Continuing processing legacy data without issuing statutory notice exposes the fiduciary to non-compliance penalties.",
    "suggested_remediation": "Draft and schedule a grandfathering notice communication plan for all active registered users.",
    "related_control_ids": ["TLI-DPDP-NOT-01"],
    "legal_review_status": "PROVISIONAL_RESEARCH_COMPLETE",
    "methodology_review_status": "METHODOLOGY_REVIEW_PENDING",
    "review_notes": "Awaiting final TLI legal review under DEC-08.",
    "created_at": "2026-10-11T12:00:00Z",
    "updated_at": "2026-10-11T12:00:00Z"
  },
  {
    "control_id": "TLI-DPDP-NOT-03",
    "control_version": "1.0.0",
    "title": "Multilingual Notice Option Mechanism",
    "objective": "Enable Data Principals to access notices in English or any Eighth Schedule language.",
    "topic": "NOTICE_TRANSPARENCY",
    "subcategory": "Multilingual Access",
    "source_id": "SRC-01",
    "source_provision": "Section 5(3) r/w Rule 5",
    "source_status": "NOTIFIED_RULES",
    "commencement_status": "SCHEDULED_COMMENCEMENT_13_MAY_2027",
    "obligation_type": "MANDATORY_STATUTORY",
    "legal_reference_summary": "The Data Principal shall be given an option to access the contents of the notice in English or any of the 22 languages specified in the Eighth Schedule to the Constitution.",
    "applicability_conditions": "Applies to all consumer-facing and public-facing Data Fiduciaries seeking consent.",